{
  "$schema": "http://json-schema.org/draft-04/schema#",
  "id": "",
  "type": "object",
  "properties": {
    "_id": {
      "id": "/_id",
      "type": "string"
    },
    "aid": {
      "id": "/aid",
      "type": "string"
    },
    "issue_iid": {
      "id": "/issue_iid",
      "type": "string"
    },
    "journal_jid": {
      "id": "/journal_jid",
      "type": "string"
    },
    "title": {
      "id": "/title",
      "type": "string"
    },
    "section": {
      "id": "/section",
      "type": "string"
    },
    "is_aop": {
      "id": "/is_aop",
      "type": "boolean"
    },
    "created": {
      "id": "/created",
      "type": "object",
      "properties": {}
    },
    "updated": {
      "id": "/updated",
      "type": "object",
      "properties": {}
    },
    "htmls": {
      "id": "/htmls",
      "type": "array",
      "items": {
        "id": "/htmls/0",
        "type": "object",
        "properties": {
          "language": {
            "id": "/htmls/0/language",
            "type": "string"
          },
          "source": {
            "id": "/htmls/0/source",
            "type": "string"
          }
        }
      }
    },
    "domain_key": {
      "id": "/domain_key",
      "type": "string"
    }
  },
  "required": [
    "_id",
    "aid",
    "issue_iid",
    "journal_jid",
    "title",
    "section",
    "is_aop",
    "created",
    "updated",
    "htmls",
    "domain_key"
  ]
}
